{
  "provider": "anchor",
  "version": 1,
  "retrieved": "2023-05-05T16:18:21.247168",
  "meta": {
    "show": "123abcde",
    "endpoint": "playsByEpisode"
  },
  "range": {
    "start": "2023-05-01",
    "end": "2023-05-04"
  },
  "data": {
    "stationId": 98765432,
    "kind": "playsByEpisode",
    "parameters": {
      "timeRange": [
        1682899200,
        1683158400
      ],
      "timeInterval": 86400,
      "limit": 3
    },
    "data": {
      "rows": [
        [
          1682899200,
          "0",
          1
        ],
        [
          1682899200,
          "1",
          1
        ],
        [
          1682899200,
          "2",
          1
        ],
        [
          1682985600,
          "3",
          3
        ],
        [
          1682985600,
          "4",
          2
        ],
        [
          1682985600,
          "5",
          2
        ],
        [
          1683072000,
          "6",
          2
        ],
        [
          1683072000,
          "7",
          2
        ],
        [
          1683072000,
          "5",
          2
        ],
        [
          1683158400,
          "5",
          5
        ],
        [
          1683158400,
          "6",
          2
        ],
        [
          1683158400,
          "7",
          2
        ]
      ],
      "columnHeaders": [
        {
          "name": "Time (UTC)",
          "type": "integer",
          "isDateTime": true
        },
        {
          "labelKey": "EpisodeTitle",
          "type": "string"
        },
        {
          "name": "Plays",
          "type": "integer"
        }
      ],
      "labels": {
        "EpisodeTitle": {
          "0": "Title 0",
          "1": "Title 1",
          "2": "Title 2",
          "3": "Title 3",
          "4": "Title 4",
          "5": "Title 5",
          "6": "Title 6",
          "7": "Title 7"
        }
      }
    }
  }
}